title,url,date_parsed,topic,topic_label,umap_x,umap_y
Mapping the landscape of histomorphological cancer phenotypes using self-supervised learning on unannotated pathology slides,https://www.nature.com/articles/s41467-024-48666-7,2024-06-13 07:41:55+00:00,4,"Histopathology, Images, Histology",7.966403,3.5150738
Conserved epigenetic hallmarks of T cell aging during immunity and malignancy,https://www.nature.com/articles/s43587-024-00649-5?s=09,2024-06-17 06:20:49+00:00,14,"Aging, Senescence, Cell",2.7287226,7.882678
The sex of organ geometry,https://www.nature.com/articles/s41586-024-07463-4,2024-05-31 06:00:00+00:00,2,"Human, Atlas, Organ",6.0484076,6.9750237
Immunocto: a massive immune cell database auto-generated for histopathology,https://arxiv.org/pdf/2406.02618,2024-06-06 08:52:40+00:00,4,"Histopathology, Images, Histology",6.9302588,4.4240828
A small-molecule TNIK inhibitor targets fibrosis in preclinical and clinical models,https://www.nature.com/articles/s41587-024-02143-0,2024-05-14 05:58:31+00:00,19,"Immune, Inflammatory, Cell",6.722394,6.3156013
Charting the cellular biogeography in colitis reveals fibroblast trajectories and coordinated spatial remodeling,https://www.sciencedirect.com/science/article/abs/pii/S009286742400254X?via%3Dihub,2024-05-14 07:09:20+00:00,19,"Immune, Inflammatory, Cell",7.022496,5.613324
Advancing Multimodal Medical Capabilities of Gemini,https://arxiv.org/abs/2405.03162,2024-05-21 10:28:37+00:00,1,"Foundation, Model, Foundation model",9.858769,4.0598965
"voyAGEr, a free web interface for the analysis of age-related gene expression alterations in human tissues",https://elifesciences.org/articles/88623,2024-05-22 11:00:49+00:00,14,"Aging, Senescence, Cell",3.609938,6.992487
A whole-slide foundation model for digital pathology from real-world data,https://www.nature.com/articles/s41586-024-07441-w,2024-05-23 07:39:48+00:00,6,"Pathology, Computational pathology, Computational",9.80934,2.9289472
Aging clocks based on accumulating stochastic variation,https://www.nature.com/articles/s43587-024-00619-x,2024-05-09 20:43:55+00:00,11,"Clocks, Aging, Clock",1.6876508,6.109332
Nature of epigenetic aging from a single-cell perspective,https://www.nature.com/articles/s43587-024-00616-0,2024-05-11 08:56:51+00:00,14,"Aging, Senescence, Cell",2.6061823,7.635413
Demographic bias in misdiagnosis by computational pathology models,https://www.nature.com/articles/s41591-024-02885-z,2024-04-19 18:01:12+00:00,6,"Pathology, Computational pathology, Computational",9.637994,2.2198546
Generation of synthetic whole-slide image tiles of tumours from RNA-sequencing data via cascaded diffusion models,https://www.nature.com/articles/s41551-024-01193-8,2024-04-30 06:53:21+00:00,10,"Imaging, Microscopy, 3d",9.178384,4.32256
"Single-cell senescence identification reveals senescence heterogeneity, trajectory, and modulators",https://www.cell.com/cell-metabolism/abstract/S1550-4131(24)00088-3#%20,2024-04-11 06:37:43+00:00,14,"Aging, Senescence, Cell",3.6134133,8.199034
Single-cell RNA sequencing of human tissue supports successful drug targets,https://www.medrxiv.org/content/10.1101/2024.04.04.24305313v1?s=09,2024-04-12 09:44:57+00:00,19,"Immune, Inflammatory, Cell",8.761892,7.569153
Spatial motifs reveal patterns in cellular architecture of complex tissues,https://www.biorxiv.org/content/10.1101/2024.04.08.588586v1,2024-04-12 18:17:14+00:00,18,"Spatial, Histology, Spatial transcriptomics",9.960191,6.6170897
DinoBloom: A Foundation Model for Generalizable Cell Embeddings in Hematology,https://arxiv.org/abs/2404.05022,2024-04-13 16:37:54+00:00,8,"Cell, Single cell, Single",7.143592,7.907885
Cellular atlas of the human ovary using morphologically guided spatial transcriptomics and single-cell sequencing,https://www.science.org/doi/10.1126/sciadv.adm7506,2024-04-15 07:59:51+00:00,18,"Spatial, Histology, Spatial transcriptomics",7.9738235,7.6999493
scButterfly: a versatile single-cell cross-modality translation method via dual-aligned variational autoencoders,https://www.nature.com/articles/s41467-024-47418-x,2024-04-09 09:07:09+00:00,8,"Cell, Single cell, Single",9.718684,6.6305203
Three million images and morphological profiles of cells treated with matched chemical and genetic perturbations,https://www.nature.com/articles/s41592-024-02241-6,2024-04-10 06:31:36+00:00,8,"Cell, Single cell, Single",7.448302,7.6484375
ExplaiNAble BioLogical Age (ENABL Age): an artificial intelligence framework for interpretable biological age,https://doi.org/10.1016/S2666-7568(23)00189-7,2024-04-10 11:30:05+00:00,3,"Aging, Age, Lifespan",3.9815907,5.7219834
Generation of synthetic whole-slide image tiles of tumours from RNA-sequencing data via cascaded diffusion models,https://www.nature.com/articles/s41551-024-01193-8,2024-03-25 14:20:50+00:00,10,"Imaging, Microscopy, 3d",9.207935,4.341588
Mapping human tissues with highly multiplexed RNA in situ hybridization,https://www.nature.com/articles/s41467-024-46437-y,2024-03-25 14:24:22+00:00,18,"Spatial, Histology, Spatial transcriptomics",7.926084,6.6224537
Resilient anatomy and local plasticity of naive and stress haematopoiesis,https://www.nature.com/articles/s41586-024-07186-6,2024-03-25 14:24:57+00:00,2,"Human, Atlas, Organ",6.625748,8.036023
Comparing classifier performance with baselines,https://www.nature.com/articles/s41592-024-02234-5,2024-03-27 07:00:00+00:00,17,"Visual, Learning, Ai",9.005605,2.7841556
A deep profile of gene expression across 18 human cancers,https://www.biorxiv.org/content/10.1101/2024.03.17.585426v1?s=09,2024-03-27 07:00:00+00:00,12,"Cancer, Spatial, Tumor",8.2705555,8.950661
The multimodality cell segmentation challenge: toward universal solutions,https://www.nature.com/articles/s41592-024-02233-6,2024-03-27 07:00:00+00:00,8,"Cell, Single cell, Single",10.433603,5.61025
Depleting myeloid-biased haematopoietic stem cells rejuvenates aged immunity,https://www.nature.com/articles/s41586-024-07238-x,2024-03-28 12:54:14+00:00,14,"Aging, Senescence, Cell",3.4517732,7.9245296
Spatial landmark detection and tissue registration with deep learning,https://www.nature.com/articles/s41592-024-02199-5,2024-03-18 09:19:13+00:00,5,"Deep, Deep learning, Learning",8.54629,5.067642
Towards a general-purpose foundation model for computational pathology,https://www.nature.com/articles/s41591-024-02857-3,2024-03-19 18:32:57+00:00,6,"Pathology, Computational pathology, Computational",9.852166,2.4719083
A visual-language foundation model for computational pathology,https://www.nature.com/articles/s41591-024-02856-4,2024-03-19 18:34:34+00:00,6,"Pathology, Computational pathology, Computational",10.348549,2.826127
A Foundational Multimodal Vision Language AI Assistant for Human Pathology,https://arxiv.org/pdf/2312.07814.pdf,2024-03-20 09:37:53+00:00,6,"Pathology, Computational pathology, Computational",10.4332695,3.6631536
A Spatial Multi-Modal Dissection of Host-Microbiome Interactions within the Colitis Tissue Microenvironment,https://www.biorxiv.org/content/10.1101/2024.03.04.583400v1,2024-03-07 15:06:43+00:00,19,"Immune, Inflammatory, Cell",7.1644697,5.6933923
C2P-GCN: Cell-to-Patch Graph Convolutional Network for Colorectal Cancer Grading,https://arxiv.org/abs/2403.04962,2024-03-11 09:24:43+00:00,5,"Deep, Deep learning, Learning",8.064419,3.4699335
Unsupervised ensemble-based phenotyping enhances discoverability of genes related to left-ventricular morphology,https://www.nature.com/articles/s42256-024-00801-1,2024-03-12 08:00:01+00:00,13,"Risk, Genetic, Rare",8.373984,6.1087956
Complementing cell taxonomies with a multicellular analysis of tissues,https://arxiv.org/abs/2403.06753,2024-03-12 09:06:02+00:00,2,"Human, Atlas, Organ",7.0594025,7.456265
stMMR: accurate and robust spatial domain identification from spatially resolved transcriptomics with multi-modal feature representation,https://www.biorxiv.org/content/10.1101/2024.02.22.581503v1,2024-02-26 09:06:36+00:00,16,"Transcriptomics, Spatial, Spatial transcriptomics",8.519517,5.6802206
Aging clock based on nucleosome reorganisation derived from cell-free DNA,https://onlinelibrary.wiley.com/doi/full/10.1111/acel.14100?campaign=wolearlyview,2024-02-15 17:17:33+00:00,11,"Clocks, Aging, Clock",1.7938802,6.9932075
CellViT: Vision Transformers for Precise Cell Segmentation and Classification,https://arxiv.org/abs/2306.15350,2024-02-19 17:23:28+00:00,8,"Cell, Single cell, Single",10.4433155,5.5023203
Regression-based Deep-Learning predicts molecular biomarkers from pathology slides,https://www.nature.com/articles/s41467-024-45589-1,2024-02-19 17:24:11+00:00,5,"Deep, Deep learning, Learning",8.199757,2.7588646
Cell Graph Transformer for Nuclei Classification,https://arxiv.org/abs/2402.12946,2024-02-21 11:54:55+00:00,8,"Cell, Single cell, Single",9.931947,5.319701
Cardiac age prediction using graph neural networks,https://doi.org/10.1101/2023.04.19.23287590,2024-02-22 08:09:50+00:00,3,"Aging, Age, Lifespan",9.190928,5.111336
Detection of senescence using machine learning algorithms based on nuclear features,https://www.nature.com/articles/s41467-024-45421-w#Sec13,2024-02-06 17:26:56+00:00,3,"Aging, Age, Lifespan",3.9196146,8.20112
The cycling and aging mouse female reproductive tract at single-cell resolution,https://www.cell.com/cell/fulltext/S0092-8674(24)00058-8,2024-02-07 16:55:50+00:00,14,"Aging, Senescence, Cell",4.072648,6.932293
Cellpose3: one-click image restoration for improved cellular segmentation,https://www.biorxiv.org/content/10.1101/2024.02.10.579780v1,2024-02-15 09:02:05+00:00,8,"Cell, Single cell, Single",10.475779,5.7947617
Aged intestinal stem cells propagate cell-intrinsic sources of inflammaging in mice,https://www.cell.com/developmental-cell/fulltext/S1534-5807(23)00611-1,2024-01-11 17:11:40+00:00,14,"Aging, Senescence, Cell",4.374004,7.6870294
3D Nuclei Segmentation by Combining GAN Based Image Synthesis and Existing 3D Manual Annotations,https://www.biorxiv.org/content/10.1101/2023.12.06.570366v1.abstract,2024-01-15 09:46:59+00:00,10,"Imaging, Microscopy, 3d",8.874676,4.3383555
"Polarity-JaM: An image analysis toolbox for cell polarity, junction and morphology quantification",https://www.biorxiv.org/content/10.1101/2024.01.24.577027v1,2024-01-31 09:45:38+00:00,8,"Cell, Single cell, Single",7.563978,7.1639752
Time-resolved single-cell transcriptomics defines immune trajectories in glioblastoma,https://www.sciencedirect.com/science/article/abs/pii/S009286742301317X?dgcid=coauthor,2023-12-21 22:47:29+00:00,19,"Immune, Inflammatory, Cell",8.816688,8.0003805
Multimodal Large Language Models are Generalist Medical Image Interpreters,https://www.medrxiv.org/content/10.1101/2023.12.21.23300146v1,2023-12-22 10:56:58+00:00,1,"Foundation, Model, Foundation model",10.433571,4.0263543
The spatial landscape of Cancer Hallmarks reveals patterns of tumor ecology,https://www.biorxiv.org/content/10.1101/2022.06.18.496114v2,2023-12-06 18:59:32+00:00,12,"Cancer, Spatial, Tumor",8.580546,9.069878
Organ aging signatures in the plasma proteome track health and disease,https://www.nature.com/articles/s41586-023-06802-1,2023-12-07 18:12:44+00:00,14,"Aging, Senescence, Cell",2.7520742,7.0190806
Spatiotemporal transcriptome atlas reveals the regional specification of the developing human brain,https://doi.org/10.1016/j.cell.2023.11.016,2023-12-13 11:26:32+00:00,18,"Spatial, Histology, Spatial transcriptomics",6.941352,6.264923
Decoding aging-dependent regenerative decline across tissues at single-cell resolution,https://www.cell.com/cell-stem-cell/fulltext/S1934-5909(23)00361-2,2023-10-30 10:32:30+00:00,14,"Aging, Senescence, Cell",3.4272182,7.4573755
Inflammation in the tumor-adjacent lung as a predictor of clinical outcome in lung adenocarcinoma,https://www.nature.com/articles/s41467-023-42327-x,2023-11-10 06:53:12+00:00,12,"Cancer, Spatial, Tumor",8.003837,9.028923
Reconstruction of the tumor spatial microenvironment along the malignant-boundary-nonmalignant axis,https://www.nature.com/articles/s41467-023-36560-7,2023-11-13 13:59:24+00:00,12,"Cancer, Spatial, Tumor",8.682433,9.282923
Liquid-biopsy proteomics combined with AI identifies cellular drivers of eye aging and disease in vivo,https://www.cell.com/cell/fulltext/S0092-8674(23)01033-4?s=03 ,2023-10-23 07:34:25+00:00,14,"Aging, Senescence, Cell",2.743802,6.950696
The human cell count and size distribution,https://www.pnas.org/doi/10.1073/pnas.2303077120,2023-09-21 07:30:10+00:00,2,"Human, Atlas, Organ",6.8088155,7.538303
Language Models Represent Space and Time,https://arxiv.org/abs/2310.02207,2023-10-05 06:51:30+00:00,0,"Segment, Space time, Language models",10.759111,4.416105
Characterizing cell-type spatial relationships across length scales in spatially resolved omics data,https://www.biorxiv.org/content/10.1101/2023.10.05.560733v1,2023-10-09 07:10:32+00:00,15,"Omics, Spatial, Spatial omics",10.698915,7.523509
Integration of spatial and single-cell data across modalities with weakly linked features,https://www.nature.com/articles/s41587-023-01935-0,2023-09-08 10:24:21+00:00,15,"Omics, Spatial, Spatial omics",10.062365,7.6241093
Characterizing Tissue Structures from Spatial Omics with Spatial Cellular Graph Partition,https://www.biorxiv.org/content/10.1101/2023.09.05.556133v1.full.pdf,2023-09-07 14:02:03+00:00,15,"Omics, Spatial, Spatial omics",10.25088,7.0671883
Integration of Multiple Spatial Omics Modalities Reveals Unique Insights into Molecular Heterogeneity of Prostate Cancer,https://www.biorxiv.org/content/10.1101/2023.08.28.555056v1.full.pdf,2023-09-04 08:27:23+00:00,12,"Cancer, Spatial, Tumor",10.163136,7.9965425
Next-Generation Morphometry for pathomics-data mining in histopathology,https://www.nature.com/articles/s41467-023-36173-0,2023-09-15 15:07:16+00:00,4,"Histopathology, Images, Histology",6.918439,4.326866
A General-Purpose Self-Supervised Model for Computational Pathology,https://arxiv.org/abs/2308.15474,2023-09-18 08:24:54+00:00,6,"Pathology, Computational pathology, Computational",9.5120945,2.4058392
NUCLEI INSTANCE SEGMENTATION AND CLASSIFICATION IN HISTOPATHOLOGY IMAGES WITH STARDIST,https://arxiv.org/pdf/2203.02284.pdf,2023-08-02 12:48:56+00:00,4,"Histopathology, Images, Histology",8.363899,4.0763736
Multi-omic rejuvenation and life span extension on exposure to youthful circulation,https://www.nature.com/articles/s43587-023-00451-9,2023-07-28 14:14:09+00:00,3,"Aging, Age, Lifespan",3.1103716,6.5219193
Cancer-associated fibroblast classification in single-cell and spatial proteomics data,https://www.nature.com/articles/s41467-023-39762-1,2023-07-28 10:04:29+00:00,12,"Cancer, Spatial, Tumor",8.68487,8.049317
Explainable multi-task learning for multi-modality biological data analysis,https://www.nature.com/articles/s41467-023-37477-x,2023-07-26 06:00:00+00:00,1,"Foundation, Model, Foundation model",9.218692,3.6160564
Deep learning predicts patients outcome and mutations from digitized histology slides in gastrointestinal stromal tumor,https://www.nature.com/articles/s41698-023-00421-9,2023-07-24 19:23:45+00:00,5,"Deep, Deep learning, Learning",7.8298764,2.7225428
Whole-body cellular mapping in mouse using standard IgG antibodies,https://www.nature.com/articles/s41587-023-01846-0,2023-07-23 16:32:45+00:00,19,"Immune, Inflammatory, Cell",7.336727,6.872583
Configurational entropy is an intrinsic driver of tissue structural heterogeneity,https://www.biorxiv.org/content/10.1101/2023.07.01.546933v1,2023-07-21 08:32:21+00:00,10,"Imaging, Microscopy, 3d",9.936131,6.771179
The genetic architecture and evolution of the human skeletal form,https://www.science.org/doi/10.1126/science.adf8009,2023-07-21 08:28:27+00:00,2,"Human, Atlas, Organ",5.4511166,6.8417873
Human BioMolecular Atlas Program (HuBMAP) papers,https://www.nature.com/collections/aihihijabe,2023-07-20 06:43:45+00:00,2,"Human, Atlas, Organ",6.5986104,6.908657
Predicting cell morphological responses to perturbations using generative modeling,https://www.biorxiv.org/content/10.1101/2023.07.17.549216v1,2023-07-20 06:37:20+00:00,8,"Cell, Single cell, Single",8.23297,7.4261746
Segment Anything,https://arxiv.org/abs/2304.02643,2023-07-14 10:09:39+00:00,17,"Visual, Learning, Ai",10.983957,5.3801384
A prognostic risk score for development and spread of chronic pain,https://doi.org/10.1038/s41591-023-02430-4,2023-07-07 14:25:58+00:00,13,"Risk, Genetic, Rare",5.596583,4.952408
Configurational entropy is an intrinsic driver of tissue structural heterogeneity,https://www.biorxiv.org/content/10.1101/2023.07.01.546933v1.full,2023-07-06 15:11:25+00:00,10,"Imaging, Microscopy, 3d",10.000235,6.901603
High-plex immunofluorescence imaging and traditional histology of the same tissue section for discovering image-based biomarkers,https://www.nature.com/articles/s43018-023-00576-1,2023-06-30 14:25:51+00:00,4,"Histopathology, Images, Histology",7.2067914,5.0181656
MultiNicheNet: a flexible framework for differential cell-cell communication analysis from multi-sample multi-condition single-cell transcriptomics data,https://www.biorxiv.org/content/10.1101/2023.06.13.544751v1,2023-06-21 08:27:37+00:00,8,"Cell, Single cell, Single",8.926455,7.494659
Aging Fly Cell Atlas identifies exhaustive aging features at cellular resolution,https://www.science.org/doi/10.1126/science.adg0934,2023-06-16 07:33:42+00:00,14,"Aging, Senescence, Cell",3.2765052,7.3316054
Spatially Resolved Gene Expression Prediction from H&E Histology Images via Bi-modal Contrastive Learning,https://arxiv.org/abs/2306.01859,2023-06-16 07:18:44+00:00,18,"Spatial, Histology, Spatial transcriptomics",7.614482,4.760567
Motif discovery algorithms in static and temporal networks: A survey,https://doi.org/10.1093/comnet/cnaa031,2023-06-12 07:28:24+00:00,16,"Transcriptomics, Spatial, Spatial transcriptomics",9.160015,4.811516
Senescent alveolar macrophages promote early- stage lung tumorigenesis,https://www.cell.com/cancer-cell/pdf/S1535-6108(23)00171-X.pdf,2023-06-02 08:08:24+00:00,12,"Cancer, Spatial, Tumor",7.7811947,9.003759
Cell-type-specific nuclear morphology predicts genomic instability and prognosis in multiple cancer types,https://www.biorxiv.org/content/10.1101/2023.05.15.539600v1,2023-05-17 11:07:24+00:00,12,"Cancer, Spatial, Tumor",7.6293564,8.238787
dietary MUFAs and lifespan extension,https://www.nature.com/articles/s41556-023-01136-6,2023-05-16 15:41:09+00:00,3,"Aging, Age, Lifespan",2.8222506,6.54162
scGPT: Towards Building a Foundation Model for Single-Cell Multi-omics Using Generative AI,,2023-05-08 06:37:37+00:00,8,"Cell, Single cell, Single",10.230655,7.4895997
Self-Supervised Learning of Phenotypic Representations from Cell Images with Weak Labels,https://arxiv.org/pdf/2209.07819.pdf,2023-05-05 12:03:17+00:00,8,"Cell, Single cell, Single",10.01679,5.047313
DINOv2: Learning Robust Visual Features without Supervision,https://arxiv.org/abs/2304.07193,2023-05-05 12:02:40+00:00,17,"Visual, Learning, Ai",10.691804,4.7327895
Heterogeneous aging across multiple organ systems and prediction of chronic disease and mortality,https://www.nature.com/articles/s41591-023-02296-6,2023-04-12 10:07:47+00:00,3,"Aging, Age, Lifespan",3.7173016,6.1534276
Multi-domain translation between single-cell imaging and sequencing data using autoencoders,https://www.nature.com/articles/s41467-020-20249-2,2023-04-03 06:00:00+00:00,8,"Cell, Single cell, Single",9.51147,6.373278
Spatial Transcriptomics Analysis of Gene Expression Prediction using Exemplar Guided Graph Neural Network,https://www.biorxiv.org/content/10.1101/2023.03.30.534914v1.full.pdf+html,2023-04-02 14:11:20+00:00,16,"Transcriptomics, Spatial, Spatial transcriptomics",8.684461,5.164214
IMC-Denoise: a content aware denoising pipeline to enhance Imaging Mass Cytometry,https://www.nature.com/articles/s41467-023-37123-6,2023-03-29 06:42:00+00:00,10,"Imaging, Microscopy, 3d",8.923362,6.1933746
In silico tissue generation and power analysis for spatial omics,https://www.nature.com/articles/s41592-023-01766-6,2023-03-29 06:42:00+00:00,15,"Omics, Spatial, Spatial omics",10.346601,7.4159737
"JUMP Cell Painting dataset: morphological impact of 136,000 chemical and genetic perturbations",https://www.biorxiv.org/content/10.1101/2023.03.23.534023v1,2023-03-27 19:25:07+00:00,8,"Cell, Single cell, Single",7.518714,7.697971
"Artificial-intelligence-based molecular classification of diffuse gliomas using rapid, label-free optical imaging",https://www.nature.com/articles/s41591-023-02252-4,2023-03-26 06:48:16+00:00,7,"Ai, Discovery, Tissue",8.61664,3.2288513
Deep learning-enabled virtual histological staining of biological samples,https://www.nature.com/articles/s41377-023-01104-7,2023-03-13 14:32:26+00:00,4,"Histopathology, Images, Histology",7.461331,3.769556
The human pathome shows sex specific aging patterns post-development,https://www.biorxiv.org/content/10.1101/2023.02.27.530179v1,2023-03-09 09:38:06+00:00,3,"Aging, Age, Lifespan",4.007229,6.821689
Self-supervised vision transformers accurately decode cellular state heterogeneity,https://www.biorxiv.org/content/10.1101/2023.01.16.524226v1,2023-02-17 14:11:58+00:00,8,"Cell, Single cell, Single",10.286465,5.3315997
SODB facilitates comprehensive exploration of spatial omics data,https://www.nature.com/articles/s41592-023-01773-7,2023-02-17 11:37:47+00:00,15,"Omics, Spatial, Spatial omics",11.047554,7.53125
Correlated evolution of social organization and lifespan in mammals,https://www.nature.com/articles/s41467-023-35869-7,2023-02-03 19:18:06+00:00,3,"Aging, Age, Lifespan",3.5362399,6.2594004
Spatially resolved multiomics of human cardiac niches,https://www.biorxiv.org/content/10.1101/2023.01.30.526202v1,2023-02-02 16:32:43+00:00,16,"Transcriptomics, Spatial, Spatial transcriptomics",8.717006,6.2382936
Single-cell spatial immune landscapes of primary and metastatic brain tumours,https://www.nature.com/articles/s41586-022-05680-3,2023-02-01 18:36:22+00:00,12,"Cancer, Spatial, Tumor",8.64245,8.462518
Multiplexed 3D atlas of state transitions and immune interaction in colorectal cancer,https://doi.org/10.1016/j.cell.2022.12.028,2023-01-23 07:00:00+00:00,12,"Cancer, Spatial, Tumor",9.353734,8.453445
NIH SenNet Consortium to map senescent cells throughout the human lifespan to understand physiological health,https://www.nature.com/articles/s43587-022-00326-5,2023-01-02 12:45:46+00:00,3,"Aging, Age, Lifespan",3.8322537,8.193588
Spatial proteomics in three-dimensional intact specimens,https://www.cell.com/cell/fulltext/S0092-8674(22)01465-9?rss=yes&utm_source=dlvr.it&utm_medium=twitter,2022-12-25 13:14:43+00:00,18,"Spatial, Histology, Spatial transcriptomics",8.195237,6.590636
Cell-type-specific aging clocks to quantify aging and rejuvenation in neurogenic regions of the brain,https://www.nature.com/articles/s43587-022-00335-4 ,2022-12-20 19:38:39+00:00,11,"Clocks, Aging, Clock",2.3122854,5.80735
Graph neural networks learn emergent tissue properties from spatial molecular profiles,https://www.biorxiv.org/content/10.1101/2022.12.08.519537v1?,2022-12-13 08:26:14+00:00,5,"Deep, Deep learning, Learning",9.480882,5.19542
Spatial biology of cancer evolution,https://www.nature.com/articles/s41576-022-00553-x,2022-12-12 08:37:17+00:00,12,"Cancer, Spatial, Tumor",8.832464,9.061115
Development and validation of AI-based pre-screening of large bowel biopsies,https://www.medrxiv.org/content/10.1101/2022.11.30.22282859v1,2022-12-12 07:40:43+00:00,7,"Ai, Discovery, Tissue",8.222521,2.9716818
Computerized tumor-infiltrating lymphocytes density score predicts survival of patients with resectable lung adenocarcinoma,https://www.cell.com/iscience/fulltext/S2589-0042(22)01877-6#relatedArticles,2022-11-28 09:57:56+00:00,12,"Cancer, Spatial, Tumor",8.199829,8.901093
Modeling intercellular communication in tissues using spatial graphs of cells,https://www.nature.com/articles/s41587-022-01467-z,2022-10-28 08:20:16+00:00,15,"Omics, Spatial, Spatial omics",9.7795105,6.5836225
"Spatial genomics maps the structure, nature and evolution of cancer clones",https://doi.org/10.1038/s41586-022-05425-2,2022-11-10 08:13:18+00:00,12,"Cancer, Spatial, Tumor",8.525686,9.193278
Contrastive learning of image- and structure based representations in drug discovery,http://schemas.microsoft.com/office/2004/12/omml,2022-11-09 15:09:09+00:00,5,"Deep, Deep learning, Learning",8.703639,3.546968
CellSighter - A neural network to classify cells in highly multiplexed images,https://www.biorxiv.org/content/10.1101/2022.11.07.515441v1,2022-11-09 13:57:18+00:00,8,"Cell, Single cell, Single",10.12836,5.8146586
Morphology and gene expression profiling provide complementary information for mapping cell state,http://schemas.microsoft.com/office/2004/12/omml,2022-11-08 10:25:38+00:00,8,"Cell, Single cell, Single",7.4133854,7.453776
Multiplexed high-throughput immune cell imaging reveals molecular health-associated phenotypes,http://schemas.microsoft.com/office/2004/12/omml,2022-11-07 08:56:53+00:00,19,"Immune, Inflammatory, Cell",9.193189,7.859261
De novo analysis of bulk RNA-seq data at spatially resolved single-cell resolution,https://www.nature.com/articles/s41467-022-34271-z,2022-11-02 07:45:53+00:00,18,"Spatial, Histology, Spatial transcriptomics",9.003468,7.6524982
MorphNet Predicts Cell Morphology from Single-Cell Gene Expression,https://www.biorxiv.org/content/10.1101/2022.10.21.513201v1,2022-10-24 11:28:04+00:00,8,"Cell, Single cell, Single",8.037673,7.5606675
Omnipose: a high-precision morphology-independent solution for bacterial cell segmentation,https://www.nature.com/articles/s41592-022-01639-4,2022-10-19 17:25:35+00:00,10,"Imaging, Microscopy, 3d",10.783623,6.013264
Spatial epitope barcoding reveals clonal tumor patch behaviors,https://www.sciencedirect.com/science/article/pii/S1535610822004433,2022-10-17 07:05:46+00:00,12,"Cancer, Spatial, Tumor",8.820989,9.158344
